{
  "$schema": "https://json-schema.org/draft/2020-12/schema",
  "$id": "today-bundle.schema.json",
  "title": "TodayBundle (GET /schools/{id}/today)",
  "type": "object",
  "required": [
    "school",
    "date",
    "generated_at",
    "air",
    "smoke",
    "plan",
    "alerts"
  ],
  "additionalProperties": false,
  "properties": {
    "school": {
      "$ref": "school.schema.json"
    },
    "date": {
      "type": "string",
      "pattern": "^\\d{4}-\\d{2}-\\d{2}$",
      "description": "IST calendar date"
    },
    "generated_at": {
      "type": "string",
      "pattern": "^\\d{4}-\\d{2}-\\d{2}T\\d{2}:\\d{2}:\\d{2}Z$",
      "description": "UTC, always ends in Z"
    },
    "air": {
      "$ref": "forecast.schema.json"
    },
    "smoke": {
      "type": "object",
      "required": [
        "now",
        "afternoon"
      ],
      "additionalProperties": false,
      "properties": {
        "now": {
          "$ref": "trace.schema.json"
        },
        "afternoon": {
          "$ref": "trace.schema.json"
        }
      }
    },
    "plan": {
      "oneOf": [
        {
          "$ref": "protocol.schema.json"
        },
        {
          "type": "null"
        }
      ],
      "description": "null until the agent has run for this date"
    },
    "alerts": {
      "type": "array",
      "items": {
        "$ref": "alert.schema.json"
      },
      "description": "Alerts sent for this date, newest first"
    }
  }
}
