{
 "school": {
  "school_id": "sample-dwarka",
  "name": "Sample Public School, Dwarka (demo)",
  "name_hi": "सैंपल पब्लिक स्कूल, द्वारका (डेमो)",
  "lat": 28.59,
  "lon": 77.05,
  "district": "South West Delhi",
  "state": "Delhi",
  "alert_emails": [
   "principal@example.com"
  ],
  "schedule": [
   {
    "slot_id": "assembly",
    "label": "Morning assembly",
    "label_hi": "सुबह की प्रार्थना सभा",
    "start": "07:40",
    "end": "08:00",
    "outdoor": true
   },
   {
    "slot_id": "recess",
    "label": "Recess",
    "label_hi": "मध्यावकाश",
    "start": "10:40",
    "end": "11:10",
    "outdoor": true
   },
   {
    "slot_id": "pe",
    "label": "PE (Classes 6-8)",
    "label_hi": "खेलकूद (कक्षा 6-8)",
    "start": "14:00",
    "end": "14:40",
    "outdoor": true
   },
   {
    "slot_id": "dispersal",
    "label": "Dispersal",
    "label_hi": "छुट्टी",
    "start": "14:40",
    "end": "15:00",
    "outdoor": true
   }
  ]
 },
 "date": "2026-10-12",
 "generated_at": "2026-10-12T01:30:00Z",
 "air": {
  "school_id": "sample-dwarka",
  "lat": 28.59,
  "lon": 77.05,
  "generated_at": "2026-10-12T01:30:00Z",
  "source": "sample",
  "now": {
   "time": "2026-10-12T01:00:00Z",
   "pm25": 112.0,
   "pm25_24h_mean": 105.3,
   "aqi": 251,
   "aqi_basis": "CPCB PM2.5 sub-index of the CAMS model's trailing 24-h mean (indicative, not an official CPCB AQI)",
   "band": "amber"
  },
  "hours": [
   {
    "time": "2026-10-12T01:00:00Z",
    "pm25": 116.0,
    "band": "amber"
   },
   {
    "time": "2026-10-12T02:00:00Z",
    "pm25": 106.0,
    "band": "amber"
   },
   {
    "time": "2026-10-12T03:00:00Z",
    "pm25": 90.0,
    "band": "amber"
   },
   {
    "time": "2026-10-12T04:00:00Z",
    "pm25": 69.0,
    "band": "amber"
   },
   {
    "time": "2026-10-12T05:00:00Z",
    "pm25": 54.0,
    "band": "green"
   },
   {
    "time": "2026-10-12T06:00:00Z",
    "pm25": 48.0,
    "band": "green"
   },
   {
    "time": "2026-10-12T07:00:00Z",
    "pm25": 47.0,
    "band": "green"
   },
   {
    "time": "2026-10-12T08:00:00Z",
    "pm25": 81.5,
    "band": "amber"
   },
   {
    "time": "2026-10-12T09:00:00Z",
    "pm25": 88.5,
    "band": "amber"
   },
   {
    "time": "2026-10-12T10:00:00Z",
    "pm25": 96.0,
    "band": "amber"
   },
   {
    "time": "2026-10-12T11:00:00Z",
    "pm25": 105.0,
    "band": "amber"
   },
   {
    "time": "2026-10-12T12:00:00Z",
    "pm25": 87.5,
    "band": "amber"
   },
   {
    "time": "2026-10-12T13:00:00Z",
    "pm25": 102.5,
    "band": "amber"
   },
   {
    "time": "2026-10-12T14:00:00Z",
    "pm25": 117.5,
    "band": "amber"
   },
   {
    "time": "2026-10-12T15:00:00Z",
    "pm25": 130.0,
    "band": "red"
   },
   {
    "time": "2026-10-12T16:00:00Z",
    "pm25": 137.5,
    "band": "red"
   },
   {
    "time": "2026-10-12T17:00:00Z",
    "pm25": 141.0,
    "band": "red"
   },
   {
    "time": "2026-10-12T18:00:00Z",
    "pm25": 140.0,
    "band": "red"
   },
   {
    "time": "2026-10-12T19:00:00Z",
    "pm25": 136.5,
    "band": "red"
   },
   {
    "time": "2026-10-12T20:00:00Z",
    "pm25": 133.5,
    "band": "red"
   },
   {
    "time": "2026-10-12T21:00:00Z",
    "pm25": 130.0,
    "band": "red"
   },
   {
    "time": "2026-10-12T22:00:00Z",
    "pm25": 126.0,
    "band": "red"
   },
   {
    "time": "2026-10-12T23:00:00Z",
    "pm25": 123.0,
    "band": "red"
   },
   {
    "time": "2026-10-13T00:00:00Z",
    "pm25": 121.0,
    "band": "red"
   }
  ]
 },
 "smoke": {
  "now": {
   "school_id": "sample-dwarka",
   "kind": "now",
   "target_time": "2026-10-12T01:00:00Z",
   "generated_at": "2026-10-12T01:30:00Z",
   "source": "sample",
   "inputs": {
    "wind": "sample",
    "fires": "sample"
   },
   "indicative": true,
   "method": "Indicative single-level (120 m) wind back-trajectory, midpoint integration; fires within corridor_km of the path, detected between 24 h before and 3 h after the parcel passed. Not a dispersion model.",
   "params": {
    "hours_back": 24,
    "step_minutes": 15,
    "corridor_km": 25,
    "frp_threshold_mw": 100,
    "min_fires": 3,
    "wind_level": "120m"
   },
   "origin": {
    "lat": 28.59,
    "lon": 77.05
   },
   "path": [
    {
     "time": "2026-10-12T01:00:00Z",
     "lat": 28.59,
     "lon": 77.05,
     "wind_speed_ms": 3.0,
     "wind_from_deg": 328.8
    },
    {
     "time": "2026-10-12T00:00:00Z",
     "lat": 28.6697,
     "lon": 76.9953,
     "wind_speed_ms": 2.75,
     "wind_from_deg": 329.1
    },
    {
     "time": "2026-10-11T23:00:00Z",
     "lat": 28.7439,
     "lon": 76.9445,
     "wind_speed_ms": 2.6,
     "wind_from_deg": 328.9
    },
    {
     "time": "2026-10-11T22:00:00Z",
     "lat": 28.8152,
     "lon": 76.895,
     "wind_speed_ms": 2.56,
     "wind_from_deg": 328.5
    },
    {
     "time": "2026-10-11T21:00:00Z",
     "lat": 28.8865,
     "lon": 76.8445,
     "wind_speed_ms": 2.62,
     "wind_from_deg": 327.9
    },
    {
     "time": "2026-10-11T20:00:00Z",
     "lat": 28.9605,
     "lon": 76.7907,
     "wind_speed_ms": 2.8,
     "wind_from_deg": 327.2
    },
    {
     "time": "2026-10-11T19:00:00Z",
     "lat": 29.0402,
     "lon": 76.7313,
     "wind_speed_ms": 3.08,
     "wind_from_deg": 326.6
    },
    {
     "time": "2026-10-11T18:00:00Z",
     "lat": 29.128,
     "lon": 76.6645,
     "wind_speed_ms": 3.44,
     "wind_from_deg": 326.2
    },
    {
     "time": "2026-10-11T17:00:00Z",
     "lat": 29.2262,
     "lon": 76.5891,
     "wind_speed_ms": 3.87,
     "wind_from_deg": 326.1
    },
    {
     "time": "2026-10-11T16:00:00Z",
     "lat": 29.3355,
     "lon": 76.504,
     "wind_speed_ms": 4.29,
     "wind_from_deg": 325.6
    },
    {
     "time": "2026-10-11T15:00:00Z",
     "lat": 29.4553,
     "lon": 76.4088,
     "wind_speed_ms": 4.71,
     "wind_from_deg": 325.0
    },
    {
     "time": "2026-10-11T14:00:00Z",
     "lat": 29.5852,
     "lon": 76.3037,
     "wind_speed_ms": 5.11,
     "wind_from_deg": 324.8
    },
    {
     "time": "2026-10-11T13:00:00Z",
     "lat": 29.7256,
     "lon": 76.1912,
     "wind_speed_ms": 5.47,
     "wind_from_deg": 325.6
    },
    {
     "time": "2026-10-11T12:00:00Z",
     "lat": 29.8765,
     "lon": 76.0744,
     "wind_speed_ms": 5.76,
     "wind_from_deg": 326.6
    },
    {
     "time": "2026-10-11T11:00:00Z",
     "lat": 30.0357,
     "lon": 75.9556,
     "wind_speed_ms": 5.96,
     "wind_from_deg": 327.7
    },
    {
     "time": "2026-10-11T10:00:00Z",
     "lat": 30.2013,
     "lon": 75.8382,
     "wind_speed_ms": 6.04,
     "wind_from_deg": 329.3
    },
    {
     "time": "2026-10-11T09:00:00Z",
     "lat": 30.3708,
     "lon": 75.7255,
     "wind_speed_ms": 6.04,
     "wind_from_deg": 331.2
    },
    {
     "time": "2026-10-11T08:00:00Z",
     "lat": 30.5411,
     "lon": 75.6199,
     "wind_speed_ms": 5.89,
     "wind_from_deg": 332.5
    },
    {
     "time": "2026-10-11T07:00:00Z",
     "lat": 30.7075,
     "lon": 75.5216,
     "wind_speed_ms": 5.64,
     "wind_from_deg": 333.7
    },
    {
     "time": "2026-10-11T06:00:00Z",
     "lat": 30.8677,
     "lon": 75.4321,
     "wind_speed_ms": 5.34,
     "wind_from_deg": 335.2
    },
    {
     "time": "2026-10-11T05:00:00Z",
     "lat": 31.0219,
     "lon": 75.3547,
     "wind_speed_ms": 5.01,
     "wind_from_deg": 337.6
    },
    {
     "time": "2026-10-11T04:00:00Z",
     "lat": 31.1672,
     "lon": 75.2872,
     "wind_speed_ms": 4.64,
     "wind_from_deg": 339.0
    },
    {
     "time": "2026-10-11T03:00:00Z",
     "lat": 31.3022,
     "lon": 75.2282,
     "wind_speed_ms": 4.26,
     "wind_from_deg": 340.0
    },
    {
     "time": "2026-10-11T02:00:00Z",
     "lat": 31.4262,
     "lon": 75.176,
     "wind_speed_ms": 3.88,
     "wind_from_deg": 340.5
    },
    {
     "time": "2026-10-11T01:00:00Z",
     "lat": 31.5404,
     "lon": 75.1295,
     "wind_speed_ms": 3.57,
     "wind_from_deg": 341.0
    }
   ],
   "upwind_from_deg": 328.3,
   "matched_fires": [
    {
     "lat": 29.3596,
     "lon": 76.281,
     "frp_mw": 8.24,
     "acq_time": "2026-10-10T20:30:00Z",
     "satellite": "N20",
     "distance_km": 16.2,
     "hours_before_arrival": 9.9,
     "district": "Jind",
     "state": "Haryana"
    },
    {
     "lat": 29.71,
     "lon": 76.5014,
     "frp_mw": 3.28,
     "acq_time": "2026-10-10T20:30:00Z",
     "satellite": "N21",
     "distance_km": 23.6,
     "hours_before_arrival": 11.0,
     "district": "Kaithal",
     "state": "Haryana"
    },
    {
     "lat": 29.7277,
     "lon": 76.436,
     "frp_mw": 6.42,
     "acq_time": "2026-10-10T20:30:00Z",
     "satellite": "N",
     "distance_km": 19.6,
     "hours_before_arrival": 11.3,
     "district": "Kaithal",
     "state": "Haryana"
    },
    {
     "lat": 29.7697,
     "lon": 76.3188,
     "frp_mw": 17.71,
     "acq_time": "2026-10-11T07:55:00Z",
     "satellite": "N",
     "distance_km": 12.9,
     "hours_before_arrival": 11.8,
     "district": "Kaithal",
     "state": "Haryana"
    },
    {
     "lat": 29.8217,
     "lon": 76.2876,
     "frp_mw": 3.51,
     "acq_time": "2026-10-10T20:30:00Z",
     "satellite": "N21",
     "distance_km": 13.7,
     "hours_before_arrival": 12.2,
     "district": "Kaithal",
     "state": "Haryana"
    },
    {
     "lat": 30.1464,
     "lon": 75.7363,
     "frp_mw": 11.3,
     "acq_time": "2026-10-10T20:30:00Z",
     "satellite": "N21",
     "distance_km": 11.5,
     "hours_before_arrival": 15.0,
     "district": "Sangrur",
     "state": "Punjab"
    },
    {
     "lat": 30.2883,
     "lon": 75.9472,
     "frp_mw": 2.92,
     "acq_time": "2026-10-10T20:30:00Z",
     "satellite": "N",
     "distance_km": 13.9,
     "hours_before_arrival": 15.1,
     "district": "Sangrur",
     "state": "Punjab"
    },
    {
     "lat": 30.2275,
     "lon": 75.8355,
     "frp_mw": 1.3,
     "acq_time": "2026-10-11T07:55:00Z",
     "satellite": "N20",
     "distance_km": 1.3,
     "hours_before_arrival": 15.1,
     "district": "Sangrur",
     "state": "Punjab"
    },
    {
     "lat": 30.3036,
     "lon": 75.9318,